{
  "contract_version": "1.0",
  "tenant_id": "demo_store",
  "proposal_id": "enrich_lap_006_battery",
  "variant_id": "lap_006",
  "catalog_version": "demo_feed_1",
  "kind": "attribute",
  "attribute_key": "battery_wh",
  "related_variant_id": null,
  "candidate_value": 55,
  "canonical_unit": "Wh",
  "source": {
    "origin": "supplier_document",
    "source_ref": "synthetic:supplier-sheet-lap-006",
    "source_version": "demo_v1",
    "extracted_at": "2026-09-26T12:00:00Z",
    "extractor_version": "offline_extract_demo_v1",
    "evidence_excerpt_ref": "demo_page_2_line_4"
  },
  "confidence": null,
  "status": "pending_review",
  "review": {
    "decision": "pending",
    "reviewer_id": null,
    "reviewed_at": null,
    "note": null
  }
}
